87	famous	유명하다	옥토버페스트가 독일에 아주 유명한 축제예요.;Oktoberfest is a very famous festival in Germany.
87	to open, to be held, to take place	열리다	올해 회의는 시애틀에서 열려요.;This year's conference will be held in Seattle.
88	to teach	가르치다	콜린 커뮤니티 대학에서 영어를 가르쳐요.;I teach English at Collin Community College.
88	busy	바쁘다	왜 그렇게 항상 바빠요?;Why are you always so busy?;오늘 저녁 늦게까지 바빠요.;I'm busy till late in the evening.
88	telephone number	휴대폰 번호	휴대폰 번호가 어떻게 되세요?;What’s your mobile number?
88	again	다시	기차가 또 다시 연착했다.;Once again the train was late.
88	text message	문자	수업 후에 왓츠앱으로 문자를 주세요.;Text me on WhatsApp after class.
88	to close	이/가 닫다	뮌스터에서 Rewe가 오후 12시에 닫아요.;Rewe closes at 12pm in Münster.
88	to open	이/가 열다	일본 식당이 오늘 안 열어요.;The Japanese restaurant is not open today.
88	stupid	어리석다	디카프리오:로즈!당신은 참 어리석어요.로즈.;DICAPRIO: Rose! You're so stupid, Rose.
88	heart, mind	마음	친구에게 마음을 줬어요.;I gave my heart to a friend.
88	professor	교수님	그 교수님은 학점을 잘 주신다.;The professor grades generally.
88	to welcome	환영하다	따뜻하게 환영해 주셔서 고맙습니다.;Thank you for your warm welcome.
88	physics	물리학	그녀는 물리학 성적으로 C를 받았다.;She got a C in Physics.
88	language exchange	언어 교환	나는 언어 교환을 할 친구가 필요하다.;I need a friend to exchange languages.
89	the week after next	다다음 주	다다음주에 만나자.;Let's meet the week after next.
89	the day after tomorrow	내일 모레	내일 모레란 말이죠?;You mean the day after tomorrow?
89	salty	짜요	하지만 바닷물은 항상 짜요.;But the water in the sea is always salty.
89	impressive	인상적이다	그 공연은 아주 인상적이었다.;That performance was pretty impressive.
89	first impression	첫인상	첫 인상이 제일 중요합니다.;The first impression is most important.
90	improve, get better	나아지다	버스로 가는 게 나을 것이다.;You'd be better going by bus.;김의 독일어가 빨리빨리 나아져요.;Kim's German is improving quickly.
90	to talk about	에 대해서 얘기하다	나는 너에 대해서 얘기하고 싶어.; I want to talk about you.
90	be popular	인기가 있다	그는 학생들에게 인기가 있어요.;He is popular with the students.
90	direction, way	방향	어느 방향으로 바람이 불고 있나요?;Which way is the wind blowing?
90	mouse (pc)	컴퓨터마우스	남자는 컴퓨터 마우스를 사용하고 있다.;The guy is using a computer mouse.
90	keyboard (pc)	키보드	그 키보드는 106키 키보드이다.;The keyboard has one hundred six keys.
90	already	이미	그는 이미 집에 갔지, 그렇지?;He's gone home, hasn't he?;그녀는 그 날 이미 그를 보았었다.;She had already seen him that day.
90	oneself	스스로	그 스스로 그것을 했다.;He did it himself.
90	at first, in the beginning	처음에	처음에 나는 그를 싫어했다.;At first I disliked him.
90	to change ones mind	마음을 바꾸다	넌 너무 쉽게 마음을 바꿔.;You change your mind too often.
91	classic	고전	독일의 고전 책에는 괴테, 실러 책이 있어요.;German classics include Goethe and Schiller.
91	to be different	N은/는 N(이)랑 다르다	한국어는 중국어랑 달라요.;Korean is different from Chinese.
91	appointment, promise	약속	내일 약속이 11시 지요?;The appointment is tomorrow at 11 o'clock?
91	never	절대	절대 한강에서 수영하명 안 돼요.;You must never swim in the Han river.
91	basket	바구니	바구니 안에 배 2 개가 있어요.;There are 2 pears in the basket.
91	album	음반	아이유 새로운 음반이 어때요?;How do you like IU's new album?
92	electric blanket	전기 장판	응, 나도 벌써부터 전기장판 깔고 잤어.;Yes, I have already slept on the electric blanket.
92	to graduate	졸업하다	저는 박사를 아직 안 졸업했어요.;I haven't graduated from my PhD yet.;그는 평점 3 .8을 받고 졸업했다.;He graduated with a GPA of 3.8.
92	nickname	별명	에어버스 A380의 별명은 고래 제트기이다.;The nickname of the Airbus A380 is the Whale Jet.
92	to be (not) interested in	는 것을 관심이 있다/없다	떡볶이 과자를 먹는 것을 관심이 있어요.;I'm interested in eating Tteokbokki snacks.;일 하는 것을 관심이 없어요.;I'm not interested in working.
92	to take off	벗다	너 집에서 신발을 안 벗어도 돼요?;Can you take off your shoes at home?
92	fireplace	벽난로	벽난로에서 장작이 타고 있다.;Wood is burning in the fireplace.
93	deadline	마감일	내일이 작문 숙제 마감일이다.;Tomorrow is the deadline for the writing homework.
93	sweet	달다	이 포도주가 내 입에는 너무 달다.;This wine is too sweet for my taste.
93	silent, quite	고요하다	바다가 호수처럼 고요하다.;The sea is as calm as a lake.
93	to borrow, to lend, to rent	빌리다	사전이 없는데 좀 빌려 주세요.;I don't have a dictionary. Please lend me one.
93	to do nothing	아무것도 안하다	지금 나도 아무것도 안해.;I'm not doing anything at the moment either.
94	uncle	삼촌	난 우리 삼촌을 뵈러 갈 거야.;I’m going to visit my uncle.
94	she	그녀	그녀는 착해. 난 그녀가 좋아.;She’s nice. I like her.
94	red light, green light	무궁화 꽃이 피었습니다	-;-
94	annoying	짜증나	그 사람때문에 정말 짜증나.;I'm really annoyed by this person.
94	all, everything	다	너 야채 다 먹어.;Eat up all your vegetables.;다행이에요.;What a relief
94	to congratulate, to celebrate	축하하다	시험 결과 축하해!;Congratulations on your test results!
94	vacation	바캉스	휴가라는 의미의 '바캉스'.;'Vacance' means vacation.
94	seat, space	자리	이 자리에 사람 없나요?;Is this seat free?
94	to bring	가져가다	우산을 가져가요. 오후에 비가 내린대요.;Take an umbrella. It's raining in the afternoon.
94	place	곳	우리 이 곳에서 나가자!;Let's get out of this place!;이 곳은 내 자리이다.;This is my place.
94	Yeouido (large island in Seoul where the parliament is located.)	여의도	우리는 여의도부터 신촌까지 걸어갔다.;We walked from Yeouido to Shinchon.
94	exactly, definitely, absolutely	꼭	저는 꼭 가볼게요.;I'll definitely go.;너는 꼭 해야 돼.;You absolutely have to do it.;다음에 꼭 같이 가요.;I will definitely go with you next time.
95	weekday	주중	이번 주중에 시간 있으세요?;Do you have time this week?
95	beverage, drink	음료수	자주 마시는 음료수가 뭐예요?;What is your favourite drink?
95	to complete	완성하다	문장을 완성해 보세요.;Try to complete the sentence.
95	to forget about sth.	을/를 잊어버리다	교수님 이름을 잊어버렸어요.;I forgot the professor's name.
95	cash	현금	저에게 현금을 빌려줄 수 있어요?;Can you lend me some cash?
96	last year	작년	그녀는 작년에 아이를 낳았다.;She had a baby last year.
96	this year	금년	금년도 저물어 가고 있다.;This year is coming a an end.
96	next year	내년	내년에 무슨 일이 있을지 누가 알겠나?;Who can say what will happen next year?
96	especially	특히	나는 숙제가 싫다. 특히 역사 숙제가.;I hate homework. Specially history homework.
96	memory	기억	이 사람은 칼라예요. 기억나세요?;This is Carla. Do you remember her?
96	to remain in memory, memorable	기억에 남다	난 작년 크리스마스가 가장 기억에 남아.;I remembered last year's Christmas the most.
96	most	가장	넌 뭐가 가장 즐거웠니?;What did you enjoy the most?
96	film festival	영화제	그 영화제는 10월에 개최된다.;The film festival takes place in October.
96	world	세계	그들은 전 세계를 여행했다.;They've travelled all over the world.
96	director	감독	그녀가 감독[국장]과 점심 식사를 한대.;She's having lunch with the Director.
96	most of the time	대부분의 시간	대부분의 시간을 홀로 보낸다.;He spends a lot of time alone.
96	guest	손님	리즈는 손님 명단에 들어 있지 않았다.;Liz wasn't on the guest list.
96	relaxing, comfortable	편안하다	이 음악은 매우 편안하다.;This music is very relaxing.
96	to each other	서로에게	그들은 서로에게 선물을 준다.;They give each other presents.
97	luck, fortune	복	새해 복 많이 받아요.;Happy new year.
97	sunrise	일출	일출 시간은 오전 5시 30분입니다.;Sunrise will be at 5:30am.
97	to premiere (a movie)	개봉하다	이 영화가 7월에 개봉할 거예요.;This movie will be released in July.
97	to bring sth. to somewhere	-을/를 -에 가져오다	바클라바를 사무실에 가져왔어요.;I brought baklava to the office.
97	to list	을/를 나열하다	이름들은 알파벳순으로 나열되어 있다.;The names are listed in alphabetical order.
97	the reason why V	V는 이유	그를 믿게 하는 설득력 있는 이유가 없다.;There is no compelling reason to believe him.
97	amazing, remarkable	엄청나다	엄청나게 큰 케이크네요!;What a huge cake!;엄청난 인기를 얻고 있는 가수.;A very popular singer.
97	plot, storyline	줄거리	줄거리가 너무 뻔했어.;The plot was way too predictable.
97	scene	장면	우리는 거의 모든 장면에 나왔다.;Most of us were in every scene.
97	layer	층	오존층에 생긴 구멍.;The hole in the ozone layer.
97	to hope, to want	바라다	그가 곧 한국에 오기를 바라요!;I hope he comes to Korea soon!
98	N fits well to someone	N에게 잘 어울리다	티셔츠 색깔이 잘 어울려요.;The color of the t-shirt suits you well.;제 여자친구가 저에게 잘 어울려요.;My girlfriend suits me well.
98	orange	주황색	주황 자전거 좋아해요.;I like orange bicycles.
98	plant	식물	그녀는 식물에 대해 아는 것이 아주 많다.;She is very knowledgeable about plants.
98	fake	가짜	이것은 가짜 식물이고, 저젓이 진짜 식물이에요.;This is a fake plant, and this is a real plant.
98	real	진짜	이것은 가짜 식물이고, 저젓이 진짜 식물이에요.;This is a fake plant, and this is a real plant.
98	in fact, actually	사실은	사실은 난 운전을 못 해.;Actually I can't drive.
98	graduation ceremony	졸업식	내 졸업식에 우리 가족이 모두 왔다.;My whole family came to my graduation.
98	article	기사	나는 그 기사를 이미 상당히 많이 썼다.;I've already written quite a bit of that article.
98	these days	요즘에	나는 너를 요즘에 보지 못했었어.;I haven't seen you lately.
99	anyone	누구	나는 너를 누구보다 더 사랑해.;I love you more than anyone.
99	night	밤	나는 어제 밤에 잘 잤어요.;I slept well last night.
99	voice	목소리	그가 큰 목소리로 말했다.;He spoke in a loud voice.
99	every start of a year	매년 초에	매년 초에 새로운 습관들을 만들려고 해요.;At the beginning of each year, I try to create new habits.
99	to use/play the phone	휴대폰을 하다	보통 일어난 후에 휴대폰을 해요.;I usually use my phone after waking up.
99	insufficient	불충분하다	그는 잠이 불충분했기 때문에 피곤했다.;He was tired because he had not had enough sleep.
99	lazy	게으르다	내 남동생은 매우 게으르다.;My little brother is very lazy.
99	energetic	활기차다	이 옷들은 재미나고 활기차 보인다.;These clothes look fun and energetic.;많은 음식을 먹은 후에 활기차게 안 느껴요.;I don't feel energetic after eating a lot of food.
99	nice, kind	친절하다	웨이터도 친절했어요.;The waiter was also kind.
99	to pay	돈을 내다	독일에서는 생일파티에서도 돈을 같이 내요?;Do you pay for birthday parties in Germany?
99	all day	하루 종일	하루 종일 비가 오락가락했다.;It rained on and off all day.