71	Do you have time off?	쉬는 시간이 있어요?	-;-
71	Nice to meet you.	처음 뵙겠습니다.	-;-
71	full name	성명	아래에 성명, 연령, 직업을 기입하세요.;Please state your name, age and occupation below.
71	gender	성별	그의 여권에 표시된 성별은 남성이다.;His gender marker on his passport is male.
71	date of birth	생년월일	너의 생년월일은 어떻게 되니?;What is the date of your birth?
71	nationality	국적	그녀는 이중 국적자이다.;She has dual nationality.
71	religion	종교	종교 지도자들의 모임.;A gathering of religious leaders
71	contact information	연락처	연락처 교환했어?;Did you exchange numbers?
71	address	주소	그 사람 주소 아니?;Do you know his address?
71	telephone	전화	전화와?;Who's calling you?
71	e-mail	이메일	이메일 주소가 어떻게 되세요?;What’s your email address?
71	doesn't exist	없음	관심 없음?;Don't want any?
71	oneself, honey	자기	자기가 자기를 따라해.;She's imitating herself.
71	adverbs of frequency	빈도 부사	-;-
71	introduction	소개	우리는 이미 소개를 받았어요.;We’ve already been introduced.
71	introduce yourself	자기소개하기	우리는 자기소개를 하는 것으로 시작했다.;We started off by introducing ourselves.
71	Chuseok (festivity)	추석	추석에 무엇을 할 계획이니?;What are your plans for Chuseok?
71	rice cake	떡	떡이다! - 나 떡 좋아해!;Rice cake! - I love it!
71	tradition	전통	옛날 전통을 계속 유지하다.;to keep up old traditions.;그 축제는 전통적으로 5월에 열린다.;The festival is traditionally held in May.
71	Songpyeon (rice cake traditionally eaten during Korean autumn festival)	송편	송편은 떡의 한 종류야.;Songpyeon is a type of rice cake.
71	Tteokguk (sliced rice cake soup)	떡국	떡국은 떡으로 만든 국이다.;Tteokguk is a rice cake soup.;난 맛있는 떡국을 좋아해.;I love eating the delicious rice cake soup.
71	new year	설날	설날에는 LA에 있을 거야.;I’ll be in LA for New Years.
71	new place	새로운 곳	그는 또한 많은 새로운 곳들을 보았다.;He also saw many new places.
71	new things	새로운 것	이 생각은 새로운 것이 아니다.;This idea isn’t new.
71	face	얼굴	다정한 얼굴;a kind face
71	noun	명사	라틴어 명사에는 격・수・성이 있다.;Latin nouns have case, number and gender.
71	unit noun / measure word	단위 명사	-;-
71	Eastern Europe	동유럽	동유럽이랑 영국.;Eastern Europe and England.
71	month	개월	그들의 나이는 0살하고 개월입니다.;They are 0 years and months old!
71	to be new	새롭다	이렇게 하니까 새롭다.;It's new doing it like this.
71	first	처음	당신은 그를 언제 처음 만났나요?;When did you first meet him?
71	around (time)	쯤	나는 그녀의 두 번째 소설을 절반 쯤 읽었다.;I’m halfway through her second novel.
71	always	항상	그는 항상 일찍 일어난다.;He always gets up early.
71	sometimes	가끔	나는 가끔 혼자 있는 것이 좋다.;I like to be on my own sometimes.
71	always	언제나	그녀는 언제나 몸매가 좋다.;She’s always had a good figure.
71	during	동안	쌀을 20분 동안 끓여라.;Boil the rice for 20 minutes.
71	before	전에	두 달 전에;two months ago
71	after	후에	오늘 방과 후에 만날까?;Shall I meet you after school today?
71	all	모두	우리는 모두 잘 지내요.;We are all doing well.
71	to laugh, to smile	웃다	그 여자는 울다 웃다 했다.;The woman cried and laughed.
71	to make a presentation	발표를 하다	언제 발표를 해볼까?;When do you want to present?
71	to do a presentation on sth	에 대해(서) 발표하다	-;-
72	flower	꽃	이 꽃 이름 아니?;Do you know the name of this flower?
72	festival	축제	매년 지역 축제가 있다.;There is a local carnival every year.
72	Munich	뮌헨	그는 뮌헨에서 성장했어요.;He grew up in Munich.
72	office	사무실	내 사무실은 5층에 있다.;My office is on the fifth floor.
72	word	단어	이 단어의 뜻이 뭐죠?;What’s the meaning of this word?
72	purpose	목적	그녀는 직장을 구할 목적으로 런던에 갔다.;She went to London with the aim of finding a job.
72	culture	문화	그들은 완전히 다른 문화 출신이다.;They come from totally different cultures.
72	history	역사	나는 역사에 관심이 많다.;I’m very interested in history.
72	young	어리다	그는 나보다 여섯 살 어리다;He is six years younger than I (am).
72	average, mean	평균	4, 5, 9의 평균은 6이다.;The average of 4, 5 and 9 is 6.;하루 평균 8시간 일한다.;I average 8 hours’ work a day.
72	just, simply	그냥	난 그냥 커피만 준비할게.;I’ll just make the coffee.
72	to celebrate	기념하다	당신 나라에서는 새해를 어떻게 기념해요?;How do people celebrate New Year in your country?
72	to bring	가져오다	우산을 잊고 안 가져오다.;Forgot to bring an umbrella.
72	to stand in line	줄을 서다	아이들은 모두 한 줄로 서 있었다.;The children all stood in a line.
72	to run	뛰어가다	그는 1마일을 4분에 뛰어갔다.;He ran a mile in 4 minutes.
72	to forget	잊어버리다	그것에 대하여 잊어버리다.;forget about it.
72	to practice	연습하다	매일 피아노 연습을 하다.;Practice piano every day.
72	to call somebody	부르다	택시를 부르다.;Call a taxi.
72	to play (an instrument)	연주하다	피아노를 연주하다.;To play the piano.
72	to enjoy something	을/를 즐기다	음악을 즐기다.;To enjoy the music.;풍경을 즐기다.;To enjoy the scenery.
73	for example...	예를 들면	예를 들면, 사람들은 여가 시간에 관해서 말하기를 좋아한다.;For example, people like to talk about the leisure time.
73	I miss you.	니가 보고 싶어!	-;-
73	Vatican	바티칸	로마에 머물렀을 때 그는 바티칸을 방문했다.;When he was there, he visited the Vatican.
73	Colosseum	콜로세움	오늘은 로마에 있는 콜로세움에 대해 이야기할 거예요.;Today, I'm going to talk about the Colosseum in Rome.
73	Asia	아시아	그는 아시아를 널리 여행했다.;He has travelled widely in Asia.
73	belly, boat, pear	배	엄마, 나 배 아파요.;Mum, my tummy hurts.;그 배가 항구로 들어왔다.;The ship steered into port.;그 것은 맛있는 배다.;It's a delicious pear.
73	raw fish	회	이 집 회를 한번 먹어 봐.;Taste the raw fish they serve here.
73	taste	취향	색깔과 스타일은 개인적인 취향의 문제이다.;The colour and style is a matter of personal taste.
73	teenager	청소년	한 무리의 청소년들이 밖에서 어정거리고 있었다.;A bunch of kids were hanging around outside.
73	plastic surgery	성형 수술	코 성형수술을 좀 해야 되겠어.;I think I'm getting a nose job.
73	tree	나무	그 나무는 벼락을 맞았다.;The tree was struck by lightning.
73	series	시리즈	장기 방영된 TV 시리즈.;A long-running TV series.
73	e-book	전자책	전자책은 큰 인기를 끌고 있다.;E-books are becoming very popular.
73	lyrics	가사	이 노래의 가사를 아니?;Do you know the lyrics to this song?
73	yourself, oneself, directly	직접	내가 그녀에게 직접 말할게.;I'll speak to her myself.;네가 직접 해. 난 시간 없어.;Do it yourself—I don’t have time.;나는 그를 직접 상대하고 싶다.;I prefer to deal with him direct.
73	to live healthy	건강하게 살다	할아버지, 오래 사시고, 건강하세요!;Grandpa, live long and be healthy!
73	to bake	굽다	오븐에 빵을 굽다.;Bake bread in an oven.
73	to joke	농담하다	그녀는 항상 농담을 한다.;She’s always cracking jokes.
73	to collect, to gather	모으다	야생화를 꺾어 모으다.;To gather wild flowers.;자선기금을 모으다.;Raise money for charity.
73	to have time	시간이 나다	네, 금요일 점심에 시간이 납니다.;Yes, I am free for lunch on Friday.
74	the day before yesterday	그제	그들은 그제 떠났다.;They left the day before yesterday.
74	the day after tomorrow	모레	우리는 모레 만날 거야.;We’re meeting the day after tomorrow.
74	to be close	친하다	나는 그와 매우 친하다.;I'm really close (friends) with him.
74	most	제일	우리는 제일 친한 친구들이다.;We’re the best of friends.;영어는 내가 제일 잘 하는 과목이다.;English is my best subject.
74	to remove/withdraw	빼다	명단에서 이름을 빼다.;Remove a name from a list.
74	to blossom	피다	나무들에 꽃이 피었다.;The trees are in blossom.
74	north	북쪽	북쪽에서 불어오는 찬 바람.;Cold winds coming from the north.
74	country	국가	국가에 대한 의무를 수행하다.;To do your duty for your country.
74	beach	해수욕장	부산 근처에는 좋은 해수욕장이 있습니까?;Is there a good beach around Busan?
74	volleyball	발리볼	우리는 어제 배구를 했다.;We played volleyball yesterday.
74	road	도로	이 도로는 여기서 끝난다.;The road ends here.
74	color	색	네가 좋아하는 색은 뭐니?;What’s your favourite colour?
74	letter (of a word)	글자	b는 알파벳의 둘째 글자이다.;‘B’ is the second letter of the alphabet.
74	sibling	형제	우리 집 형제들은 늘 다퉈.;My siblings always quarrel.
74	meaning	뜻	이 단어의 뜻이 뭐죠?;What’s the meaning of this word?
74	advertisement	광고	우리는 지역 신문에 광고를 냈다.;We put an ad in the local paper.
75	title, heading	제목	제목은 페이지 바로 맨 위에 있다.;The title is right at the top of the page.
75	writing, text, article	글	그 글은 25호에 실렸다.;The article appeared in issue 25.
75	souvenir	기념품	관광객들이 기념품을 사고 있다.;The tourists are shopping for souvenirs.
75	pronunciation	발음	당신은 발음이 아주 좋아요.;Your pronunciation is excellent.
75	interest, attention	관심	난 운동에 관심 없다.;I’m not interested in sport.;나는 역사에 관심이 많다.;I’m very interested in history.
75	dessert	디저트	디저트는 식후에 가져다 주세요.;Please bring my dessert after the meal.
75	to find/look for	찾다	문제에 대한 답을 찾다.;Find an answer to the problem.
75	to count	세다	1부터 10까지 세다.;To count from 1 to 10.
75	to have great interest in...	-에 관심이 많다	그는 음악에 아주 관심이 많다.;He is really into music.
76	when I was young...	어릴 때	어릴 때 영국에 갔었다.;I went to England when I was a child.;우리는 어릴 때부터 친구다.;We're friends from childhood.
76	(dining) table	식탁	우리는 주방 식탁에서 밥을 먹었다.;We ate at the kitchen table.
76	bookstore	서점	여자가 서점 앞에 있다.;The woman is in front of a book store.;난 그걸 서점에서 샀어요.;I bought it at the bookstore.
76	to be the same	똑같다	두 아이는 키가 똑같다.;The two children are the same height.
76	besides/next to N	N 옆에	네 옆에 앉아도 되겠니?;Can I sit next to you?;우리 집은 학교 옆에 있는 거예요.;Our house is the one next to the school.
76	bored	심심하다	영화 보러 가자. 나 심심해.;Let's go to the movies. I'm bored.
76	hungry	배가 고프다	그 아이들은 항상 배가 고파 보인다.;The children always seem to be hungry.
76	to have a meal	식사하다	우리는 식사할 곳을 찾고 있었다.;We were looking for a place to eat.
76	to make friends	친구를 만들다	당신이 많은 좋은 친구들을 만들 수 있길 희망합니다!;Hope you make many good friends!
76	to run	달리다	그가 문 밖으로 달려 나갔다.;He ran out the door.
76	to take a video	동영상을 찍어	그것은 1080p HD 동영상을 찍을 수 있다.;It records 1080p HD videos.
76	to take a photo	사진을 찍다	우리 사진을 찍어 주시겠습니까?;Would you take a picture of us?
76	to contact	-에게 연락하다	하루 종일 네게 연락하려고 하는 중이야.;I’ve been trying to contact you all day.
76	to make a phone call	전화하다	도착하면 잊지 말고 전화해!;Remember to call me when you arrive!
76	to appreciate sth.	-을/를 감상하다	사람들이 콘서트 홀에서 음악을 감상하고 있다.;People are enjoying music in a concert hall.
77	Of course!	당연하지.	당연하지! 정말 진심으로 말하는 거야.;Totally! I’m saying it from the bottom of my heart!
77	thermometer	체온계	열이 있어서 나는 체온계가 필요하다.;I need a thermometer because of my fever.
77	Bachelor degree	학사	그녀는 영어 학사 학위가 있다.;She’s got a BA in English.
77	Master degree	석사	경영학 석사 공부.;To do an MBA.
77	Ph.D.	박사	박사 과정을 밟고 있는 학생.;A candidate for a PhD.
77	engineer	엔지니어	그녀는 아주 유능한 엔지니어이다.;She is a very capable engineer.
77	grape	포도	포도주는 포도로 만들어진다.;Wine is made from grapes.
77	tomato	토마토	그는 토마토와 오이를 좋아한다.;He likes tomatoes and cucumbers.
77	broccoli	브로콜리	브로콜리 샀어요?;Did you get the broccoli?
77	carrot	당근	당근을 먹을 수 없습니다.;I can't eat carrots.
77	salad	샐러드	남자가 샐러드를 담고 있다.;The man is getting a salad.
77	onion	양파	양파를 버터에 볶아라.;Fry the onions in butter.
77	egg	계란	나는 계란 한 꾸러미를 샀다.;I bought a dozen eggs.
77	sugar	설탕	내 커피에 설탕 넣었니?;Did you put sugar in my coffee?
77	salt	소금	소금과 후추로 양념을 하라.;Season with salt and pepper.
77	soy sauce	간장	그 다음에 간장을 넣고.;Then you add the soy sauce.
77	knife	칼	그것을 칼을 가지고 잘라라.;Cut it with a knife.
77	daily life, routine	일상	틀에 박힌 내 일상의 중단.;A break in my daily routine
77	swimming pool	수영장	그 호텔에 수영장이 있었니?;Was there a pool at the hotel?
77	village	시골	그녀의 책은 시골 마을 생활에 대한 것이다.;Her books are about village life.
77	town	마을	그 마을들은 버려져 있었다.;The villages had been deserted.
77	maximum	최대	그것은 세계 최대 컴퓨터 회사이다.;It’s the world’s biggest computer company.;브라질은 세계 최대 커피 생산국이다.;Brazil is the world’s largest producer of coffee.
77	healthy	건강하다	그는 나이에 비해 건강하다.;He's in good shape for his age.
77	be fun	즐겁다	음악을 듣는 것은 즐겁다.;Music is pleasant to listen to.;그녀는 함께 있으면 정말 즐겁다.;She’s really fun to be with.
77	to cough	기침을 하다	때론 감기에 걸기면 기침을 하기도 해요.;Sometimes you also cough when you have a cold.
77	to get sick	병이 생기다	병은 잘 먹지 못해서 생기기도 한다.;Illness may come from a poor diet.
77	to bring sth.	을/를 가져오다	올 때 잊지 말고 책을 가져 와.;Don’t forget to bring your books with you.
77	to take away	가져 가다	그녀는 우유를 좀 가지러 갔다.;She’s gone for some milk.;그들이 배달하는 데 차를 가지고 갔다.;They took the car out for a run.
77	to start sth.	을/를 시작하다	불꽃놀이는 언제 시작해요?;When do the fireworks start?
77	to end sth.	을/를 끝내다	우리는 회의를 빨리 끝내버렸다.;We got the meeting over with quickly.
78	exam	쓰기 시험	쓰기 시험지를 준비했어요.;I prepared for the exam.
78	quite, silent	조용하다	자전거는 싸고, 작고, 조용하다.;Bicycles are cheap, small and silent.
78	loud, noisy	시끄럽다	위층 사람들은 진짜 시끄럽다.;The people that are living above us are very noisy.;이 사무실은 아주 시끄럽다.;It's very noisy in this office.;음악은 시끄러울 수 있다.;Music can be loud.
78	work day	평일	그 센터는 평일 오전 9시부터 오후 6시까지 문을 연다.;The centre is open from 9a.m. to 6p.m. on weekdays.
78	to focus/concentrate on sth.	에 집중하다	모든 시선이 나에게로 집중해 있었다.;All eyes were focused on me.
78	to ask someone	에게 묻다	나나씨는 정우에게 물었어요.;Nana asked Jungwoo.
78	sometimes	때때로	그는 때때로 내게 편지를 보낸다.;He sometimes writes to me.
78	otherwise, or else	그렇지 않으면	그들이 올 리가 없어. 그렇지 않으면 그들이 전화를 했을 거야.;They can't be coming or else they'd have called.
78	finally, lastly	마지막으로	마지막으로 노래를 몇 곡 듣겠습니다.;Finally, let's listen to a few songs.
79	because of this	이거 때문에	내가 이거 때문에 속 썩는 일이 한두 번이 아니에요.;I'ts not the first time that I'm heart broken because of this.
79	when (I) have time	시간이 나면	시간 나면 가이드 좀 해 주세요.;Please be my guide when you have time.
79	comfortable, convenient	편하다	댁의 집에서는 맘이 편해요.;I feel very comfortable in your home.
80	a center	센터	데이케어 센터.;A day care centre.;시내의 쇼핑센터.;A downtown shopping plaza.
80	content, material	내용	정보를 담은 책의 내용.;The informational content of a book.
80	martial arts	무술	난 무술 영화 좋아해.;I like martial arts movies.
80	(work, study, ...) hard	열심히	넌 더 열심히 해 봐야 해.;You must try harder.;그 애는 수업 시간에 열심히 공부한다.;She works hard in class.
80	club	동호회	나는 인터넷 동호회를 만들었다.;I've made a club on the Internet.;그는 야구 동호회의 회원이다.;He is a member of the baseball club.
80	to join sth. (e.g. a club)	에 가입하다	나는 헬스클럽에 가입한 지 얼마 안 된다.;I just joined a gym.;그는 외바퀴 자전거 클럽에 가입했다.;He joined a unicycling club.
80	sth. is important	이/가 중요하다	당신이 거기 오는 것이 내게는 아주 중요해요.;It’s very important to me that you should be there.;네 생각도 역시 중요해.;Your feelings are important too.
81	employee	직원	그녀는 일을 잘하는 직원이다.;She is a good employee.
81	building	건물	이 건물은 정부 재산이다.;This building is government property.
81	dialect	사투리	모두가 내 사투리를 놀린다.;Everyone makes fun of my dialect.
81	tax, dues	회비	회비는 일 년에 2만 원이다.;Membership fee is 20 thousand won per year.
81	comment	댓글	나는 댓글을 달 수 없어.;I am unable to post comments.
81	training	훈련	그는 올림픽 팀을 훈련시킨다.;He trains the Olympic team.
81	experience	경험	우리는 모두 경험을 통해 배운다.;We all learn by experience.
81	almost, nearly	거의	그 병은 거의 비어 있다.;The bottle’s nearly empty.
81	close, near	가깝다	그의 집은 아주 가깝다.;His house is very near.;내 생일은 크리스마스와 아주 가깝다.;My birthday is very near Christmas.
81	afoot	걸어서	나는 걸어서 학교에 가다.;I go to school on foot.
81	to quit, stop, discontinue	그만두다	그만두고 싶으면 당장 그만둬.;If you want to quit, quit right now.
81	to participate	참여하다	이 토론에 참여 해주셔서 감사합니다.;Thank you for joining this talk.
81	to improve	개선하다	그녀의 컴퓨터 성능을 개선하기.;Improve her computer’s performance.
82	conference	컨퍼런스	그건 3층 컨퍼런스 룸에서 있어요.;It's in the third floor conference room.
82	to hold a conference	컨퍼런스 하다	그는 비즈니스 컨퍼런스에 참석하고 있었어요.;He was attending a business conference.
82	boss, superior	상사	그녀는 (직장) 상사와 달아났다.;She ran away with her boss.
82	cloud	구름	해가 구름 뒤로 들어갔다.;The sun went behind a cloud.
82	to be interested in	에 관심이 많다	나 이것에 관심이 많아.;I am so interested in this.;나는 너에 대해 관심이 많다.;I'm very interested in you.
82	to understand	이해하다	제 입장도 이해해 주세요.;Try to understand my side of things, please.;제 선생님은 절 이해해 주세요.;My teacher understands me.
82	thing	물건	내 물건들이 다 어디 갔지?;Where's all my stuff?
82	a long ago	옛날	우리는 옛날부터 그를 알았다.;We know him of old.;내가 옛날엔 너의 아빠를 알았지.;I used to know your pa.
82	oven	오븐	그후에 그것을 오븐에 넣으세요.;Afterwards, put it in the oven.;파이는 오븐 속에 들어 있다.;The pie is in the oven.
82	housewarming party	집들이 파티	그 남자는 집들이 파티를 토요일에 할 것이다.;The man's housewarming party will be held on Saturday.
82	be full (belly)	배가 부르다	너무 배 불러요.;I'm so full.;배가 부르면 적게 먹는다.;When you feel full, you eat less.
82	head office, headquarter	본사	그 회사의 본사는 런던에 있다.;The firm's headquarters are in London.;그 회사는 서울에 본사가 있다.;The company is headquartered in Seoul.
82	to improve	을/를 개선하다	지역의 공공 서비스를 개선하다.;To improve public services in the area.;그녀의 컴퓨터 성능을 개선하기.;Improve her computer's performance.
83	conversely, vice versa	반대로(도)	나는 그 이야기를 그 반대로 들었다;I heard the story the other way around.
83	opinion	의견	그래, 당신 의견은 어떤가요?;Well, what’s your verdict?;당신의 솔직한 의견을 말해 봐요.;Give me your honest opinion.
83	floor, bottom	바닥	바닥 위로 물이 철벅 떨어졌다.;Water splashed onto the floor.
83	theater	연극	나는 연극 분야에서 일하고 싶다.;I want to work in theatre.
83	to go backpacking	배낭여행을 가다	바다로 가족 여행을 갔어.;My family went to the sea.
84	thought, idea	생각	내 생각은 그녀의 생각과 달랐다.;My ideas differed from hers.
84	to be similar	비슷하다	그는 자기 아버지와 아주 비슷하다.;He’s very like his father.
84	best	최고다	재즈는 내가 들어 본 음악 중 최고다.;Jazz is the best music I ever heard.
84	beauty salon	미용실	나는 Andre 미용실에서 머리를 깎았다.;I get my hair cut at Andre's Hair Salon.
84	hair dresser	미용사	내 남동생은 동네 미용실에서 미용사로 일한다.;My brother works as a hairdresser in a local salon.
84	art gallery	미술관	그 미술관에는 입장료가 없다.;There is no entrance fee to the gallery.
84	amusement park	놀이공원	놀이공원에는 많은 놀이기구들이 있다.;There are many rides at amusement parks.
84	fireworks	불꽃놀이	불꽃놀이는 언제 시작해요?;When do the fireworks start?
84	concert	콘서트	그 콘서트에는 사람이 얼마나 왔나요?;How many people were there at the concert?
84	exhibition	전시회	그 전시회는 일년에 한 번 개최된다.;The exhibition is held annually.
84	ballet	발레 공연	발레공연은 몇 시에 시작합니까?;What time does the ballet start?
84	the Great Wall (of China)	만리장성	하지만 만리장성은 그저 하나의 벽(방벽)이 아니다.;But the Great Wall of China is not just one wall.
84	Mongolia	몽골	그 몽골 여자는 사슴가죽 옷을 만들었다.;The Mongolian woman made deerskin clothes.
84	sound, noise, voice	소리	개 짖는 소리가 들렸다.;I could hear a dog barking.
84	fish	생선	나는 생선은 좋아하지 않는다.;I don’t like fish.;난 생선을 먹을 건데. 넌?;I’m having fish. What about you?
84	elephant	코끼리	그 아이들은 동물원에서 코끼리를 탔다.;The kids had a ride on an elephant at the zoo.
84	scuba diving	스쿠버 다이빙	소녀가 스쿠버 다이빙을 하고 있다.;The girl is scuba-diving.
84	to fish	낚시하다	오늘은 낚시하러 가고 싶다.;I want to go fishing today.
84	to cut hair	머리를 자르다	응, 머리를 자르고 있어.;Yeah, I'm getting my hair cut.
84	several/few days	며칠 동안	그들은 며칠 동안 어디 갔어요.;They’ve gone away for a few days.
86	How to say this in Korean?	이거 한국어로 어떻게 말해요?	-;-
86	cool	멋있다	네가 입고 있는 그 옷 참 멋있다.;The clothes you're wearing are so cool.
86	last week	저번 주	바로 저번 주에 그 친구를 위해서 송별회를 열었어.;We gave a farewell party for him just last week.
86	far, distant	멀다	우리 집은 여기서 멀다.;My house is far from here.
86	language exchange	언어를 교환	한국 언어 교환 친구를 만났어요.;I met my Korean language exchange partner.
86	landscape, scenery	풍경	기분 좋은 시골 풍경.;Pleasant rural scenery.
86	(software) developer	개발자	싸이는 소프트웨어 개발자로서의 자격이 없었다.;Psy was not qualified to be a software developer.
87	half-half	반반	이걸 반반씩 나누자.;Let's split this fifty-fifty.
87	nose	코	네 코에서 콧물 흘러.;Your nose is running.
87	dangerous, risky	위험하다	흡연은 너의 건강에 위험해.;Smoking is hazardous to your health.;모기는 정말 위험해요!;Mosquitoes are very dangerous!;여기서 수영하는 건 위험하다.;Swimming here is unsafe.
87	relatives	친척	대구에서 친척들이랑 떡국 먹는 중!;Enjoying tteokguk with my relatives in Daegu!
87	to review, revise	복습하다	배운 것을 복습해 보자.;Let's review what you learned.
87	to study in advance	예습하다	예습하는 것도 좋은 생각이고.;It's also a good idea to study in advance.
87	I think, according to my opinion	제 생각에는	제 생각에는 기차로 가야 할 것 같습니다.;I think we should take the train.
87	ugly	못생기다	그 애가 나한테 진짜 못생겼대!;He said he was really ugly to me!
87	handsome	잘생겼다	그는 키가 크고 잘 생겼어요.;He is tall and handsome.
